{
  "schemaVersion": "1.0",
  "profileId": "example.steam.123456.macos-arm64",
  "revision": 42,
  "game": {
    "canonicalId": "game_example_001",
    "displayName": "Example Direct3D 12 Game",
    "publisher": "Example Studio",
    "storefronts": [
      {
        "kind": "steam",
        "appId": "123456"
      }
    ]
  },
  "selectors": {
    "gameBuild": {
      "manifestId": "steam-depot-manifest-99887766",
      "requiredFiles": [
        {
          "path": "Game/Binaries/Win64/Game.exe",
          "sha256": "aaaaaaaaaaaaaaaaaaaaaaaaaaaaaaaaaaaaaaaaaaaaaaaaaaaaaaaaaaaaaaaa"
        }
      ]
    },
    "launcherBuild": {
      "version": "4.12.0"
    },
    "host": {
      "architecture": "arm64",
      "macos": {
        "min": "14.4"
      },
      "gpuFamilies": ["apple7", "apple8", "apple9", "apple10"],
      "memoryClassesGiB": [16, 24, 32, 64]
    }
  },
  "runtime": {
    "generation": "rtg_v1_example_20260719",
    "layers": [
      {
        "role": "host",
        "digest": "sha256:bbbbbbbbbbbbbbbbbbbbbbbbbbbbbbbbbbbbbbbbbbbbbbbbbbbbbbbbbbbbbbbb"
      },
      {
        "role": "wine",
        "digest": "sha256:cccccccccccccccccccccccccccccccccccccccccccccccccccccccccccccccc"
      },
      {
        "role": "profile",
        "digest": "sha256:dddddddddddddddddddddddddddddddddddddddddddddddddddddddddddddddd"
      }
    ],
    "cpuProvider": "fex-arm64ec",
    "defaultGraphicsProvider": "metal12",
    "syncProvider": "adaptive",
    "windowsVersion": "10"
  },
  "processPolicies": [
    {
      "id": "launcher",
      "priority": 100,
      "match": {
        "pathGlob": "**/Launcher.exe"
      },
      "execution": {
        "graphicsProvider": "dxmt",
        "syncProvider": "conservative",
        "networkPolicy": "allow",
        "debugPolicy": "crash-only"
      },
      "services": {
        "media": "mf-videotoolbox-v2"
      }
    },
    {
      "id": "game",
      "priority": 200,
      "match": {
        "pathGlob": "**/Game/Binaries/Win64/Game.exe",
        "sha256": "aaaaaaaaaaaaaaaaaaaaaaaaaaaaaaaaaaaaaaaaaaaaaaaaaaaaaaaaaaaaaaaa"
      },
      "execution": {
        "graphicsProvider": "metal12",
        "syncProvider": "wait-address",
        "featureMask": "metal12.apple9.game-example.rev7",
        "networkPolicy": "allow",
        "debugPolicy": "crash-only"
      },
      "services": {
        "audio": "xaudio-coreaudio-v3",
        "input": "xinput-gamecontroller-v2",
        "presentation": "hdr-vrr-v4"
      }
    }
  ],
  "filesystem": {
    "denyHostRoot": true,
    "caseMode": "windows-insensitive",
    "driveMappings": [
      {
        "letter": "C",
        "target": "runtime",
        "access": "read-only"
      },
      {
        "letter": "G",
        "target": "game",
        "access": "read-write"
      },
      {
        "letter": "S",
        "target": "saves",
        "access": "read-write"
      },
      {
        "letter": "T",
        "target": "temp",
        "access": "read-write"
      }
    ]
  },
  "healthChecks": [
    {
      "kind": "process-started",
      "target": "Game.exe",
      "deadlineSeconds": 60,
      "severity": "fatal"
    },
    {
      "kind": "frame-presented",
      "target": "main-swapchain",
      "deadlineSeconds": 120,
      "severity": "fatal"
    },
    {
      "kind": "clean-exit",
      "severity": "degraded"
    }
  ],
  "telemetry": {
    "defaultLevel": "essential",
    "redactionPolicy": "standard-v3",
    "sampling": 0.1
  },
  "certification": {
    "level": "certified",
    "testedAt": "2026-07-19T00:00:00Z",
    "testPlanId": "tp_example_d3d12_17",
    "matrixDigest": "sha256:eeeeeeeeeeeeeeeeeeeeeeeeeeeeeeeeeeeeeeeeeeeeeeeeeeeeeeeeeeeeeeee",
    "knownLimitations": [
      "Ray tracing disabled on Apple GPU families below the certified capability tier."
    ]
  }
}
